{
  "$schema": "https://json-schema.org/draft/2020-12/schema",
  "type": "object",
  "additionalProperties": false,
  "required": [
    "schema_version",
    "skill",
    "language",
    "context",
    "sources",
    "content"
  ],
  "properties": {
    "schema_version": {
      "const": "1.0"
    },
    "skill": {
      "const": "tw-edu-feedback-writer"
    },
    "language": {
      "const": "zh-TW"
    },
    "context": {
      "type": "object",
      "additionalProperties": false,
      "required": [
        "subject",
        "grade",
        "topic"
      ],
      "properties": {
        "subject": {
          "type": "string",
          "minLength": 1
        },
        "grade": {
          "type": "string",
          "minLength": 1
        },
        "topic": {
          "type": "string",
          "minLength": 1
        }
      }
    },
    "sources": {
      "type": "array",
      "items": {
        "type": "object",
        "additionalProperties": false,
        "required": [
          "title",
          "status"
        ],
        "properties": {
          "title": {
            "type": "string",
            "minLength": 1
          },
          "url": {
            "type": "string"
          },
          "status": {
            "enum": [
              "verified",
              "user_provided",
              "pending"
            ]
          }
        }
      }
    },
    "content": {
      "type": "object",
      "additionalProperties": false,
      "required": [
        "title",
        "students"
      ],
      "properties": {
        "title": {
          "type": "string",
          "minLength": 1
        },
        "students": {
          "type": "array",
          "minItems": 1,
          "items": {
            "type": "object",
            "additionalProperties": false,
            "required": [
              "student_id",
              "observations",
              "strengths",
              "next_steps",
              "feedback"
            ],
            "properties": {
              "student_id": {
                "type": "string",
                "minLength": 1
              },
              "observations": {
                "type": "array",
                "minItems": 1,
                "items": {
                  "type": "string",
                  "minLength": 1
                }
              },
              "strengths": {
                "type": "array",
                "minItems": 1,
                "items": {
                  "type": "string",
                  "minLength": 1
                }
              },
              "next_steps": {
                "type": "array",
                "minItems": 1,
                "items": {
                  "type": "string",
                  "minLength": 1
                }
              },
              "feedback": {
                "type": "string",
                "minLength": 1
              }
            }
          }
        }
      }
    }
  }
}
