{
  "schema_version": "1.0",
  "skill": "tw-edu-feedback-writer",
  "language": "zh-TW",
  "context": {
    "subject": "國語文",
    "grade": "國中八年級",
    "topic": "環境觀察"
  },
  "sources": [
    {
      "title": "教師提供教材",
      "status": "user_provided"
    }
  ],
  "content": {
    "title": "學習回饋（範例）",
    "students": [
      {
        "student_id": "SAMPLE-01",
        "observations": [
          "能指出文本中的感官詞"
        ],
        "strengths": [
          "引用具體"
        ],
        "next_steps": [
          "補充效果說明"
        ],
        "feedback": "你已能找出證據，下一步請說明這個詞帶來的感受。"
      }
    ]
  }
}
